{
  "$schema": "https://json-schema.org/draft/2020-12/schema",
  "$id": "https://research-machine.local/schemas/collaborator-proposal-review.schema.json",
  "title": "Provider-neutral collaborator proposal review",
  "type": "object",
  "required": [
    "review_version",
    "review_id",
    "proposal_record_sha256",
    "reviewer",
    "reviewed_at",
    "overall_assessment",
    "decisions"
  ],
  "properties": {
    "review_version": {"const": 1},
    "review_id": {"$ref": "#/$defs/canonicalNonEmptyText"},
    "proposal_record_sha256": {"$ref": "#/$defs/sha256"},
    "reviewer": {
      "type": "object",
      "required": ["reviewer_id", "role"],
      "properties": {
        "reviewer_id": {"$ref": "#/$defs/canonicalNonEmptyText"},
        "role": {"$ref": "#/$defs/canonicalNonEmptyText"}
      },
      "additionalProperties": false
    },
    "reviewed_at": {
      "type": "string",
      "format": "date-time",
      "pattern": "^(?:\\d{4}-\\d{2}-\\d{2}T\\d{2}:\\d{2}:\\d{2}(?:\\.\\d+)?(?:Z|[+-]\\d{2}:\\d{2}))$"
    },
    "overall_assessment": {"$ref": "#/$defs/boundedReviewText"},
    "decisions": {
      "type": "array",
      "minItems": 1,
      "items": {
        "type": "object",
        "required": [
          "suggestion_id",
          "disposition",
          "rationale",
          "domain_route"
        ],
        "properties": {
          "suggestion_id": {"$ref": "#/$defs/canonicalNonEmptyText"},
          "disposition": {
            "enum": ["advance_to_domain_review", "reject", "defer"]
          },
          "rationale": {"$ref": "#/$defs/boundedReviewText"},
          "domain_route": {
            "enum": [
              "none",
              "question.add",
              "hypothesis.propose",
              "design.revise",
              "protocol.amend",
              "next-action.recommend"
            ]
          }
        },
        "allOf": [
          {
            "if": {
              "properties": {"disposition": {"const": "advance_to_domain_review"}},
              "required": ["disposition"]
            },
            "then": {
              "properties": {
                "domain_route": {
                  "enum": [
                    "question.add",
                    "hypothesis.propose",
                    "design.revise",
                    "protocol.amend",
                    "next-action.recommend"
                  ]
                }
              }
            },
            "else": {
              "properties": {"domain_route": {"const": "none"}}
            }
          }
        ],
        "additionalProperties": false
      }
    }
  },
  "additionalProperties": false,
  "$defs": {
    "canonicalNonEmptyText": {
      "type": "string",
      "pattern": "^(?:\\S|\\S.*\\S)$"
    },
    "boundedReviewText": {
      "allOf": [
        {"$ref": "#/$defs/canonicalNonEmptyText"},
        {
          "not": {
            "pattern": "\\b(?:accepts?|accepted|approves?|approved|authorizes?|authorized|confirms?|confirmed|proves?|proved|proof|validated)\\b|canonical write|canonical action|evidence creation|creates evidence|created evidence"
          }
        }
      ]
    },
    "sha256": {
      "type": "string",
      "pattern": "^[0-9a-f]{64}$"
    }
  }
}
